{
  "id": "PF-003",
  "title": "Reject trailing JSON documents",
  "category": "admission",
  "decision_model": "parse-result",
  "exposure": "PUBLIC_PILOT_ONLY",
  "invariant": "A parser must consume exactly one complete security-bearing JSON value plus optional whitespace.",
  "starter": "starter",
  "grader": "grader",
  "reference": "reference",
  "public_safety": "synthetic",
  "limitations": []
}
